category,title,story,url
Arts & Culture,You are well  able to overcome adversity,"“BUT Caleb quieted the people before Moses and said, ‘Let us go up at once and occupy it, for we are well able to ...",https://www.sundaymail.co.zw/you-are-well-able-to-overcome-adversity
Arts & Culture,Drug rehabilitation centres,"IN case you have a son, daughter, friend or relative who has a problem with drugs, here is a list and contact details of ...",https://www.sundaymail.co.zw/drug-rehab-centres-42
Arts & Culture,Hospital visiting times,"Harare Parirenyatwa Hospital General wards:1pm-2pm Private wards 5pm-6pm Mbuya Nehanda Hospital: 6am-6:30am, 1pm-2pm — ...",https://www.sundaymail.co.zw/hospital-visiting-times-50
Arts & Culture,Easy way to cook tasty free-range chicken,"BECAUSE of its nature, a free-range or roadrunner chicken needs more cooking time. This will guarantee you a tasty and ...",https://www.sundaymail.co.zw/easy-way-to-cook-tasty-free-range-chicken
Arts & Culture,Family feud intensifying by the day,"DEAR Amai, I hope you are well. We are a middle-aged couple with two children. We were fortunate to have moved and ...",https://www.sundaymail.co.zw/family-feud-intensifying-by-the-day
Sports,NEW: South Africa-based scout tracks Zimbabwean players,Online Reporter A 16-year-old footballer from Harare’s Southlea Park has impressed renowned South Africa-based scout ...,https://www.sundaymail.co.zw/new-south-africa-based-scout-tracks-zimbabwean-players
Sports,BILLIAT RED-CARDED  AS MANICA GO TOP,Zimpapers Sports Hub Herantals . . . . . . . . . . . . .  (1) 1 Yadah . . . . . . . . . . . . . . . .  (0) 0 FORMER ...,https://www.sundaymail.co.zw/billiat-red-carded-as-manica-go-top
Sports,Samson Choruwa was a player from another planet,"EXACTLY 22 years to the day, on May 5, 2002, a 19-year-old Samson Choruwa, who had become a sensational player at ...",https://www.sundaymail.co.zw/samson-choruwa-was-a-player-from-another-planet
Sports,Chipangura’s rise from inmate to teammate,"Veronica Gwaze Sports Reporter WHENEVER Castle Lager Premiership striker Jerry Chipangura steps onto the pitch, he feels ...",https://www.sundaymail.co.zw/chipanguras-rise-from-inmate-to-teammate
Sports,Sigauke’s rugby journey from ashes of defeat,"Tinashe Kusema WITH the Zimbabwe Rugby Under-20 team, the Junior Sables, failing to qualify for the World Rugby U20 ...",https://www.sundaymail.co.zw/sigaukes-rugby-journey-from-ashes-of-defeat
Sports,Injury woes threaten French Open,WORLD number four Daniil Medvedev faces an anxious wait to know the full extent of an injury that forced him out of the ...,https://www.sundaymail.co.zw/injury-woes-threaten-french-open
Sports,From Glen View to French Cup: Chikoko’s basketball glory,Tinashe Kusema VITALIS CHIKOKO spent the better part of the last few days going through congratulatory messages in his ...,https://www.sundaymail.co.zw/from-glen-view-to-french-cup-chikokos-basketball-glory
Sports,"City, Arsenal keep title fight alive",Erling HAALAND’S first four-goal haul in the Premier League left Manchester City three wins away from a historic fourth ...,https://www.sundaymail.co.zw/city-arsenal-keep-title-fight-alive
Sports,Harare City success erases  past setbacks for Maruwa,"Zimpapers Sports Hub Herbert “JOMPANO’’ Maruwa may have endured an ignominious exit at Premiership giants Dynamos, but ...",https://www.sundaymail.co.zw/harare-city-success-erases-past-setbacks-for-maruwa
Sports,Sables dominate Zambia in rugby test,Zimpapers Sports Hub Zimbabwe . . . . . . . . . . . . . . . .  (24) 32 Zambia . . . . . . . . . . . . . . . . . . .  (6) ...,https://www.sundaymail.co.zw/sables-dominate-zambia-in-rugby-test
Sports,Chevrons out to  level T20I series,"Sports Reporter THE Chevrons captain, Sikandar Raza, is optimistic his charges have learnt from the mistakes in the ...",https://www.sundaymail.co.zw/chevrons-out-to-level-t20i-series
Sports,Kyrie Irving’s big night helps Mavs eliminate Clippers,KYRIE IRVING scored 28 of his 30 points in the second half and the Dallas Mavericks advanced to the second round with a ...,https://www.sundaymail.co.zw/kyrie-irvings-big-night-helps-mavs-eliminate-clippers
Sports,Heavyweight  boxing  on the canvas,"Langton Nyakwenda THREE years ago, Anesu Motsi was touted as the new Kilimanjaro after he burst onto the local amateur ...",https://www.sundaymail.co.zw/heavyweight-boxing-on-the-canvas
Sports,Chegutu Pirates could sail into marketing opportunity,"Arthur Choga EVER since I started following football, I have known about Chegutu Pirates. I knew them from the black and ...",https://www.sundaymail.co.zw/chegutu-pirates-could-sail-into-marketing-opportunity
Sports,NEW: Warriors to play Lesotho at Orlando Stadium in World Cup qualifier,"Online Reporter ZIMBABWE will play their next World Cup qualifier against Lesotho at Orlando Stadium in Johannesburg, ...",https://www.sundaymail.co.zw/new-warriors-to-play-lesotho-at-orlando-stadium-in-world-cup-qualifier
Sports,"Three epic PSL matches to watch today . . . Dynamos, Highlanders, CAPS United in tough battles","Tadious Manyepo Sports Reporter COMPETITION in the Castle Lager Premier Soccer League is heating up, with much expected ...",https://www.sundaymail.co.zw/three-epic-psl-matches-to-watch-today-dynamos-highlanders-caps-united-in-tough-battles
Sports,"PSL act on DeMbare, Chegutu Pirates game",Sports Reporter THE Premier Soccer League (PSL) have begun acting on the aborted game between Chegutu Pirates and ...,https://www.sundaymail.co.zw/psl-act-on-dembare-chegutu-pirates-game
Sports,Peter Ndlovu backs local players,Langton Nyakwenda FORMER Dynamos star Samson Choruwa might have faded into oblivion since a nasty knee-injury cut short ...,https://www.sundaymail.co.zw/peter-ndlovu-backs-local-players
Sports,Splinter netball league emerges amid chaos,Veronica Gwaze Sports Reporter A breakaway netball league called Tacco Super Netball League (TSNL) has been formed ...,https://www.sundaymail.co.zw/splinter-netball-league-emerges-amid-chaos
Sports,Olympic dream takes backseat  for runner Mudzinganyama,Tinashe Kusema Zimpapers Sports Hub WHAT a difference a couple of pictures can make! The Totalsports Two Oceans Marathon ...,https://www.sundaymail.co.zw/olympic-dream-takes-backseat-for-runner-mudzinganyama
Sports,Power behind the gloves  Phiri  impacts boxing,Langton Nyakwenda RARELY do you see them grabbing the headlines because most of the attention goes to those in the ...,https://www.sundaymail.co.zw/power-behind-the-gloves-phiri-impacts-boxing
Sports,It’s high time mines begin mining talent again,THE Paris 2024 Summer Olympic Games are now a little less than 90 days away. These quadrennial sporting festivals are ...,https://www.sundaymail.co.zw/its-high-time-mines-begin-mining-talent-again
Sports,"Antipas conduct taints  Chicken Inn, Yadah match",Zimpapers Sports Hub CHICKEN INN coach Joey Antipas hogged the limelight for the wrong reasons in the Castle Lager ...,https://www.sundaymail.co.zw/antipas-conduct-taints-chicken-inn-yadah-match
Sports,Makarawu shatters record on road to Olympics,Tinashe Kusema NATIONAL Athletics Association of Zimbabwe (NAAZ) president Tendayi Tagara felt vindicated as news broke ...,https://www.sundaymail.co.zw/makarawu-shatters-record-on-road-to-olympics
Sports,"Quest for revenge anchors Zimbabwe, Kenya  rugby final",Zimpapers Sports Hub WHEN Zimbabwe and Kenya meet in the Barthes Trophy final at Harare Sports Club’s Machinery Exchange ...,https://www.sundaymail.co.zw/quest-for-revenge-anchors-zimbabwe-kenya-rugby-final
Sports,"NEW: Dembare, Chegutu Pirates match abandoned",Online Reporter Chegutu Pirates   …..  0 Dynamos…………….. (0) 1 GOAL-LINE TECHNOLOGY ...,https://www.sundaymail.co.zw/dembarenew-dembare-chegutu-pirates-match-abandoned
Sports, NEW: ‘Pogba’ shines again  …as Grabowski speaks highly of 12-year-old starlet,Online Reporter While Continental Bright Stars Academy dominated at an Independence tournament held at Ngoni Stadium in ...,https://www.sundaymail.co.zw/new-pogba-shines-again-as-grabowski-speaks-highly-of-12-year-old-starlet
Sports,Premier  League  action sees  four draws . . . including FC Platinum’s missed opportunity,"Zimpapers Sports Hub DRAWS were the order of the day yesterday in the Castle Lager Premier Soccer League, with all four ...",https://www.sundaymail.co.zw/premier-league-action-sees-four-draws-including-fc-platinums-missed-opportunity
Sports,The road to Bangladesh: Lady Chevrons  ready for qualifiers,"Don Makanyanga Sports Reporter ZIMBABWE’S senior women’s cricket team, the Lady Chevrons, will seek to correct their ...",https://www.sundaymail.co.zw/the-road-to-bangladesh-lady-chevrons-ready-for-qualifiers
Sports,Documentary celebrates  Tymon Mabaleka’s exploits,"Don Makanyanga Sports Reporter EVERY time the name Tymon Mabaleka is mentioned, many will remember the late footballer ...",https://www.sundaymail.co.zw/documentary-celebrates-tymon-mabalekas-exploits
Sports,"Junior Sables secure Barthes first win, eye further success",Tinashe Kusema Zimbabwe Under-20  . . . . . . . . . . . . . . (19) 46 Tunisia Under-20 . . . . . . . . . . . . . . . . ...,https://www.sundaymail.co.zw/junior-sables-secure-barthes-first-win-eye-further-success
Sports,Warriors to play  Lesotho in  South Africa . . . as fans take ZIFA to task over coach appointment,Sports Reporters WHILE the Zimbabwe Football Association (ZIFA) Normalisation Committee remains tight-lipped on the ...,https://www.sundaymail.co.zw/warriors-to-play-lesotho-in-south-africa-as-fans-take-zifa-to-task-over-coach-appointment
Sports,Uhuru Cup  venues find new life as schools  of excellence,"Tadious Manyepo Sports Reporter THE case of stadiums and venues turning into white elephants, especially after countries ...",https://www.sundaymail.co.zw/uhuru-cup-venues-find-new-life-as-schools-of-excellence
Sports,Show sports fans some respect!,"OUR Premier Soccer League is quite unique, as it probably is the only elite division where a 51-year-old feels fit and ...",https://www.sundaymail.co.zw/show-sports-fans-some-respect
Sports,How much cover do our athletes have?,"Arthur Choga IN the years I spent in sports management, I have learnt that there are two main things that can affect a ...",https://www.sundaymail.co.zw/how-much-cover-do-our-athletes-have
Sports,Bosso rescue point from Ngezi,Zimpapers Sports Hub PACESETTERS Highlanders are guaranteed another week at the summit of the log after rescuing a point ...,https://www.sundaymail.co.zw/bosso-rescue-point-from-ngezi
Sports,Uhuru clash excites Buhera,Sports Reporter The Independence Cup clash between Dynamos and Highlanders at the Murambinda B High School grounds in ...,https://www.sundaymail.co.zw/uhuru-clash-excites-buhera
Sports,World Cup preps on,"WITH preparations for hosting the 2027 World Cup in motion, Zimbabwe Cricket (ZC) is set to expand the capacity of the ...",https://www.sundaymail.co.zw/world-cup-preps-on
Sports,Let the games begin,LATE confirmation due to an impasse between the Zimbabwe Rugby Union (ZRU) and the Sports and Recreation Commission ...,https://www.sundaymail.co.zw/let-the-games-begin
Sports,Crowd trouble: Should we bring back bouncers?,"Some soccer fans were more than convinced that the late Premier Soccer League referee, Tichaona “Giant” Chapfika, was a ...",https://www.sundaymail.co.zw/crowd-trouble-should-we-bring-back-bouncers
Sports,My first love was football: Masvanise,"Tinashe Kusema WHEN Wilson Masvanise stepped onto the stage during last weekend’s Novice Zimbabwe competition, the ...",https://www.sundaymail.co.zw/my-first-love-was-football-masvanise
Sports,Zim duo spoil SA’s Two Oceans party,Sports Reporter THE Zimbabwe duo of Givemore Mudzinganyama and Loveness Madziva played the role of party spoilers to ...,https://www.sundaymail.co.zw/zim-duo-spoil-sas-two-oceans-party
Sports,Murambinda makes Independence Cup history,"Langton Nyakwenda ON Thursday, Murambinda in Buhera writes its own piece of history when it hosts the country’s two ...",https://www.sundaymail.co.zw/murambinda-makes-independence-cup-history
Sports,Arteta praises Emery,"ASTON VILLA’S progress under former Arsenal manager Unai Emery has been incredible, his successor Mikel Arteta at the ...",https://www.sundaymail.co.zw/arteta-praises-emery
Sports,It’s DeMbare versus DeMbare Lite at Wadzanai,Langton Nyakwenda A TENSION-FILLED match is expected at Wadzanai Stadium in Shamva this afternoon as ambitious side ...,https://www.sundaymail.co.zw/its-dembare-versus-dembare-lite-at-wadzanai
Sports,Safeguarding in sports: Going beyond buzzwords,Arthur Choga BEYOND signing a letter of indemnity absolving a school or club of any blame in the event of an accident ...,https://www.sundaymail.co.zw/safeguarding-in-sports-going-beyond-buzzwords
Sports,"NEW: DeMbare, Bosso unveil kits","Online Reporter FOOTBALL giants Dynamos FC and Highlanders FC have unveiled three Adidas playing kits, plus training and ...",https://www.sundaymail.co.zw/new-dembare-bosso-unveil-kits
Sports,"FC Platinum, CAPS United match abandoned",Zimpapers Sports Hub THE Castle Lager Premier Soccer League game of the week between pacesetters FC Platinum and CAPS ...,https://www.sundaymail.co.zw/fc-platinum-caps-united-match-abandoned
Sports,Northern Region  Women’s Football returns,Sports Reporter THE Northern Region Women’s Soccer League (NRWSL) will return this month with a pre-season tournament at ...,https://www.sundaymail.co.zw/northern-region-womens-football-returns
Sports,"Chirinda still grounded, Mukamba fails to resurrect","Langton Nyakwenda A LOT was expected from the highly sought-after striker, Obriel Chirinda, this season after he was ...",https://www.sundaymail.co.zw/chirinda-still-grounded-mukamba-fails-to-resurrect
Sports,Rufaro Stadium renovations were like putting lipstick on a frog,"THE jokes at the Harare City Council continue to write themselves. Bra Shakes understands that when Rufaro Stadium, ...",https://www.sundaymail.co.zw/rufaro-renovations-were-like-putting-lipstick-on-a-frog
Sports,Doorman reflects on African Games experience,Ellina Mhlanga Lorna Doorman  took some persuading for her to accept the call up to be part of the triathlon team for ...,https://www.sundaymail.co.zw/doorman-reflects-on-african-games-experience
Sports,Schools’ rugby festival return beckons,"Tinashe Kusema WHEN preparing for any major sporting event, the final days leading up to the competition are like the ...",https://www.sundaymail.co.zw/schools-rugby-festival-return-beckons
Sports,"Manchester United, Liverpool renew hostilities",LIVERPOOL head into today’s top of the Premier League and know that eight more wins will secure a perfect swansong for ...,https://www.sundaymail.co.zw/man-u-liverpool-renew-hostilities
Sports,Mugeri-Tiripano happy to be back,Blessing Malinganiza LADY CHEVRONS top order batter Chipo Mugeri-Tiripano is happy to have recovered in time for the ...,https://www.sundaymail.co.zw/mugeri-tiripano-happy-to-be-back
Sports,NEW: Zimbabwe move up FIFA rankings,Online Reporter The Warriors reaped the benefits of utilising the FIFA international break as they moved two places up ...,https://www.sundaymail.co.zw/new-zimbabwe-move-up-fifa-rankings
Sports,NEW: Grand plan for Zimbabwe’s young pool players,"Online Reporter THE United Chitungwiza Pool League (UCPL) is one of the most competitive leagues in the country, with ...",https://www.sundaymail.co.zw/new-grand-plan-for-zimbabwes-young-pool-players
Sports,"NEW: Phiri, Simon Junior fight set for arbitration",Online Reporter FAST-RISING Zimbabwean boxer Aliyah Phiri will know the fate of his disputed win against Harry Simon ...,https://www.sundaymail.co.zw/new-phiri-simon-junior-fight-set-for-arbitration
Sports,DeMbare not panicking,Langton Nyakwenda IT has been an indifferent Easter holiday for last season’s Castle Lager Premier Soccer League’s top ...,https://www.sundaymail.co.zw/dembare-not-panicking
Sports,Dynamos’ seven million souls in anguish,"AS we were all beginning to enjoy our Easter holiday on Friday, Dynamos, a once dominant force in local football, were ...",https://www.sundaymail.co.zw/dynamos-seven-million-souls-in-anguish
Sports,Reliving Lady  Chevrons’ golden moment,Sports Reporter WHEN the women’s cricket team sensationally overcame rivals South Africa to claim gold in the African ...,https://www.sundaymail.co.zw/reliving-lady-chevrons-golden-moment
Sports,Zimbabwe crush Papua New Guinea,Sports Reporter The Lady Chevrons began their three-match Twenty20 series with a resounding eight-wicket victory over ...,https://www.sundaymail.co.zw/zimbabwe-crush-papua-new-guinea
Sports,Council of Southern Africa Football Associations to honour stars,THE Council of Southern Africa Football Associations (COSAFA) are set to stage their inaugural annual awards that will ...,https://www.sundaymail.co.zw/cosafa-to-honour-stars
Sports,Chapepa sisters destined for greatness,"Ellina Mhlanga FOR rising tennis star Kuzivaishe Chapepa, what started as sibling rivalry with her elder sister Kudzai ...",https://www.sundaymail.co.zw/chapepa-sisters-destined-for-greatness
Sports,Out of the water and onto the rugby pitch,"Tinashe Kusema IF one was to throw a stone at a group of rugby-loving youngsters, the odds are pretty high that it will ...",https://www.sundaymail.co.zw/out-of-the-water-and-onto-the-rugby-pitch
Sports,From Phiri to Milanzi,"Langton Nyakwenda FOR years, Hassan Milanzi has been a backbencher, yet, according to those who know him better, the ...",https://www.sundaymail.co.zw/from-phiri-to-milanzi
Sports,Arteta wants  Arsenal to embrace massive moment,ARSENAL manager Mikel Arteta wants his team to enjoy the moment in today’s Premier League clash against a Manchester ...,https://www.sundaymail.co.zw/arteta-wants-arsenal-to-embrace-massive-moment
Sports,NEW: Green Fuel FC winger Tino Meke tipped to shine once more,"Online Reporter UNLIKE last season when they failed to get a win in their opening three games, Green Fuel FC have hit ...",https://www.sundaymail.co.zw/new-green-fuel-fc-winger-tino-meke-tipped-to-shine-once-more
Sports,Warriors to meet Kenya in final,Zambia . . . . . . . . . . . . . . . . . . . . . .   (2) 2 Zimbabwe . . . . . . . . . . . . . . . . . . .    (2) 2 ...,https://www.sundaymail.co.zw/warriors-to-meet-kenya-in-final
Sports,And still the undisputed champion of Africa!,Langton Nyakwenda THERE is a special vibe in the country following another milestone achievement by a local pugilist. ...,https://www.sundaymail.co.zw/and-still-the-undisputed-champion-of-africa
