category,title,story,url
Politics,"Women in politics: Controversies, struggles and male bias","The birth of a new Zimbabwe at independence filled many people - both men and women - with optimism.
Pan-Africanist ...",https://www.sundaymail.co.zw/women-in-politics-controversies-struggles-and-male-bias
Politics,‘Dirty politics began in the war’,"WE continue narrating the political journey of Cde Lecture, Norman Makotsi. This week, the liberation struggle fighter ...",https://www.sundaymail.co.zw/dirty-politics-began-in-the-war
Politics,Humanity prevails over politics,"The devastation from Cyclone Idai was a national disaster, although largely localised to a handful of eastern districts, ...",https://www.sundaymail.co.zw/humanity-prevails-over-politics
Politics,‘Politics became an unavoidable route’,"We chronicle the political life of former Whawha detainee Cde Agrippa Samuriwo. Cde Samuriwo, who comes from a family of ...",https://www.sundaymail.co.zw/politics-became-an-unavoidable-route
Politics,Christian women urged to join politics,WOMEN from religious backgrounds such as the church should actively participate in national politics to instil Christian ...,https://www.sundaymail.co.zw/christian-women-urged-to-join-politics
Politics,It’s time to abandon adversarial politics,"In spite of my traumatic memories of the days of British colonialism, I hasten to admit that recent words of Queen ...",https://www.sundaymail.co.zw/its-time-to-abandon-adversarial-politics
Politics,Whither the legacy of opposition politics,Richard Runyararo Mahomva The participation by opposition parties in the just-ended election is quite commendable.,https://www.sundaymail.co.zw/whither-the-legacy-of-opposition-politics
Politics,‘Christians must get involved in politics’,"TOMORROW, Zimbabweans decide in a historic election pitting 23 presidential candidates with 5, 5 million voters ...",https://www.sundaymail.co.zw/christians-must-get-involved-in-politics
Politics,MDC Alliance: Pitfalls of running without ‘mother’s milk of politics’,"“DADDY, I think Chamisa will be defeated by ZEC. He can’t win this election,” my seven-year-old daughter said to ...",https://www.sundaymail.co.zw/mdc-alliance-pitfalls-of-running-without-mothers-milk-of-politics
Politics,A violent welcome to politics,"Norman Muchemwa Politics is not for the faint-hearted or lily-livered. For Mrs Vimbai Tsvangirai-Java, the move from ...",https://www.sundaymail.co.zw/a-violent-welcome-to-politics
Politics,MDC Alliance and politics of paranoia,Tau Tawengwa The 2018 harmonised elections are on this month and the nation seems enthusiastic to vote in this historic poll.,https://www.sundaymail.co.zw/mdc-alliance-and-politics-of-paranoia
Politics,Enter era of friendly politics,"When Zanu-PF announced that the ruling party would hold joint rallies for primary election candidates, sceptics found it ...",https://www.sundaymail.co.zw/enter-era-of-friendly-politics
Politics,"Economy over politics, says ED","The era of prioritising politics over the economy is over as the new administration primes the country for growth, ...",https://www.sundaymail.co.zw/economy-over-politics-says-ed
Politics,Editorial Comment: A sick brand of politics,"This week we were reminded of Gore Vidal, the American essayist who died back in 2012 and was referred to by some as the ...",https://www.sundaymail.co.zw/editorial-comment-a-sick-brand-of-politics
Politics,We do not  eat politics,"For far too long, Zimbabwe has been the nation that eats politics.",https://www.sundaymail.co.zw/we-do-not-eat-politics
Politics,MDC-T’s politics of ‘shayisano’,"Wendy Nyakurerwa-Matinde Assistant Editor While elections are the embodiment of democracy, it is crucial that they be ...",https://www.sundaymail.co.zw/mdc-ts-politics-of-shayisano
Politics,‘Tsvangirai changed Zanu-PF politics’,Edwin Mwase and Ruvimbo Chakanyuka The late MDC-T leader Mr Morgan Tsvangirai nudged Zanu-PF’s centralised philosophy of ...,https://www.sundaymail.co.zw/tsvangirai-changed-zanu-pf-politics
Politics,Politics of urban spaces in Zimbabwe,"Professor Innocent Chirisa Last week, I touched on an important issue, being a description of the urban spaces in Zimbabwe.",https://www.sundaymail.co.zw/politics-of-urban-spaces-in-zimbabwe
Politics,The politics of privatisation in Zimbabwe,"Tau Tawengwa In 1980, Government adopted scientific socialism as its developmental and governance paradigm.",https://www.sundaymail.co.zw/the-politics-of-privatisation-in-zimbabwe
Politics,Church and politics in 2018. . . the church brand tainted in 2017 . . . will new year be a new beginning?,Fatima Bulla THE Church in Zimbabwe has been left wounded by the negative elements within the institution which hogged ...,https://www.sundaymail.co.zw/church-and-politics-in-2018-the-church-brand-tainted-in-2017-will-new-year-be-a-new-beginning
Politics,‘The best politics is economics’ – ED sets new tone for Zanu-PF,President Emmerson Mnangagwa on Thursday challenged the ruling Zanu-PF to shift focus from mainly politics to economic ...,https://www.sundaymail.co.zw/the-best-politics-is-economics-ed-sets-new-tone-for-zanu-pf
Politics,No second place in politics,"Gibson Nyikadzino While President Mugabe is inspiring the youth, his political opponents are busy terrifying and ...",https://www.sundaymail.co.zw/no-second-place-in-politics
Politics,"Politics is a process, not an event","WHAT an exciting week? The media had a feast. Zimbabweans being Zimbabweans went into overdrive ai??i?? rumours, ...",https://www.sundaymail.co.zw/politics-is-a-process-not-an-event
Politics,"‘No politics in birth,  ID registration’","Vincent Gono Government is committed to issuing birth certificates and national identity cards to all citizens, ...",https://www.sundaymail.co.zw/no-politics-in-birth-id-registration
Politics,Ethnicity and succession politics,A disturbing narrative seems to be gaining currency among some characters in Zanu-PF who are positioning themselves for ...,https://www.sundaymail.co.zw/ethnicity-and-succession-politics
Politics,The politics of human bodies,Dr Christine Peta Disability Issues — What does it mean to be viewed as someone who has a normal or abnormal body? ...,https://www.sundaymail.co.zw/the-politics-of-human-bodies
Politics,"Nathaniel Manheru – Politics: Keeping ground,  conquering new turf","The Other Side: Nathaniel Manheru One basic rule in politics is never to concede ground, still less to allow shrinkage ...",https://www.sundaymail.co.zw/nathaniel-manheru-politics-keeping-ground-conquering-new-turf
Politics,Disputed elections — the bane of African politics,Most post-colonial dispensations in Africa have remained fragile owing to disputed election outcomes in which opposition ...,https://www.sundaymail.co.zw/disputed-elections-the-bane-of-african-politics
Politics,COMMENT: The nation that eats politics,Things are happening in Zimbabwe. And then again they are not happening.,https://www.sundaymail.co.zw/comment-the-nation-that-eats-politics
Politics,Business Forum: Fine line between  politics and business,Politicians are the policy makers and they wield the power to make decisions that can shape the business environment. ...,https://www.sundaymail.co.zw/business-forum-fine-line-between-politics-and-business
Politics,The year opposition politics sunk into oblivion,"From the preponderance of splits to the injudicious decision to boycott by-elections, 2015 was the year in which the ...",https://www.sundaymail.co.zw/the-year-opposition-politics-sunk-into-oblivion
Politics,The politics of church uniforms,Attending a church service as a visitor is bound to make some people feel out of place as church members in most ...,https://www.sundaymail.co.zw/the-politics-of-church-uniforms
Politics,"50 not out: First Lady talks life, politics [Includes VIDEO CLIP]","On July 23, 2015, First Lady Amai Grace Mugabe turned 50-years-old; a milestone she celebrated at a fundraising dinner ...",https://www.sundaymail.co.zw/50-not-out-first-lady-talks-life-politics
Politics,Corporate Talk: Boardroom politics killing institutions in Zimbabwe,"WHEN you get the opportunity of being a board member, you realise how boardroom politics is the number one killer of ...",https://www.sundaymail.co.zw/corporate-talk-boardroom-politics-killing-institutions-in-zimbabwe
Politics,"AFRICA DESK: After the  politics, the economy","On May 25, 2015 the continent celebrated the Organisation of African Unity’s 52nd anniversary, and, of course, the OAU ...",https://www.sundaymail.co.zw/analysis-after-the-politics-the-economy
Politics,ENVIRONMENT: The politics of a changing climate,"Allen Mutyambizi and Padmore Paradzayi In 2014, countries gathered in Lima, Peru and agreed to come up with climate ...",https://www.sundaymail.co.zw/environment-the-politics-of-a-changing-climate
Politics,OPINION: Race Relations and Politics in Southern Africa,"Recently, while reading about Zimbabwe’s pre-independence politics and the liberation war, I came across some ...",https://www.sundaymail.co.zw/opinion-race-relations-and-politics-in-southern-africa
Politics,The politics of business,“A DEVELOPMENTAL state is characterised by a government with sufficient organisation and authority to drive forward its ...,https://www.sundaymail.co.zw/the-politics-of-business
Politics,CRICKET: Blame politics not me: Mangongo,"From Eddie Chikamhi in Kampala, Uganda Ousted national cricket coach Stephen Mangongo has opened up on the board’s ...",https://www.sundaymail.co.zw/cricket-blame-politics-not-me-mangongo
Politics,"Away from politics,  meeting has a full plate",The Sixth Zanu-PF National People’s Congress must formulate effective strategies to implement the Zimbabwe Agenda for ...,https://www.sundaymail.co.zw/away-from-politics-congress-has-a-full-plate
Arts & Culture,AI slowly redefining academic dishonesty,80pc of students may be submitting AI-generated assignments — Dr Tsabora Fatima Bulla-Musakwa FROM translating languages ...,https://www.sundaymail.co.zw/ai-slowly-redefining-academic-dishonesty
Arts & Culture,Binga incest cases alarmingly shoot through the roof,"COURTS in Binga are reporting a disturbingly high number of rape cases involving family members, particularly cousins. ...",https://www.sundaymail.co.zw/binga-incest-cases-alarmingly-shoot-through-the-roof
Arts & Culture,"In some shops, customers are regarded as a nuisance","Your Money, Your Call Cresencia Marjorie Chiremba IN a small corner store on one of the bustling streets of Harare, my ...",https://www.sundaymail.co.zw/in-some-shops-customers-are-regarded-as-a-nuisance
Arts & Culture,Embrace issues of bodily difference,Dr Christine Peta Disability Issues BODILY differences and restrictions in role effectiveness play a central role in ...,https://www.sundaymail.co.zw/embrace-issues-of-bodily-difference
Arts & Culture,Get ready for the new school term,Gabriel Manyeruke THE period just after school holidays is often a time of mixed emotions for learners. While the ...,https://www.sundaymail.co.zw/get-ready-for-the-new-school-term
Arts & Culture,Winter shouldn’t distract us from studies,Patricia Maseko THE second term is upon us. This is usually one of the most challenging learning periods because of the ...,https://www.sundaymail.co.zw/winter-shouldnt-distract-us-from-studies
Arts & Culture,The new plagiarism arms race,AN academic paper titled “Chatting and Cheating: Ensuring Academic Integrity in the Era of ChatGPT” was recently ...,https://www.sundaymail.co.zw/the-new-plagiarism-arms-race
Arts & Culture,Drug rehabilitation centres,"IN case you have a son, daughter, friend or relative who has a problem with drugs, here is a list and contact details of ...",https://www.sundaymail.co.zw/drug-rehab-centres-45
Arts & Culture,"Simple,delicious pork trotter stew",PORK trotters are relatively easy to prepare. They require less time to cook and are loved by many — both men and women. ...,https://www.sundaymail.co.zw/simpledelicious-pork-trotter-stew
Arts & Culture,Foodscaping for beauty and bites,"Andrew Mangwarara NO matter how big or small the space is, it can be transformed into a pleasing green environment. This ...",https://www.sundaymail.co.zw/foodscaping-for-beauty-and-bites
Arts & Culture,Hollywood meets Zimbabwean flavour,"Film Review Tinashe Kusema I AM a simple man. In terms of sport, LeBron James is my greatest of all time. I usually ...",https://www.sundaymail.co.zw/hollywood-meets-zimbabwean-flavour
Arts & Culture,Behold! Gringo reborn,"Prince Mushawevato WHEN Lazarus Boora passed away, many thought the “Gringo” drama series and the character were dead ...",https://www.sundaymail.co.zw/behold-gringo-reborn
Arts & Culture,Wife stole my money,"Mudzimba Dr Chisamba Dear Amai, I hope I find you well. I am aged 34 and my wife is 33. We are blessed with two lovely ...",https://www.sundaymail.co.zw/wife-stole-my-money
Arts & Culture,Street theatre comes back to life,"Society Reporter AT the turn of the millennium, street theatre was one of the most sought-after forms of entertainment. ...",https://www.sundaymail.co.zw/street-theatre-comes-back-to-life
Arts & Culture,Romeo Gasa’s band in disarray,Dennis Chimanzi HAS sungura musician Romeo Gasa and his band Extra Valembe’s dream come to a crashing end? This is a ...,https://www.sundaymail.co.zw/romeo-gasas-band-in-disarray
Arts & Culture,Have faith in God’s promise of a brighter tomorrow,"“INSTEAD of bronze, I will bring you gold; instead of iron, I will bring you silver; instead of wood, I will bring you ...",https://www.sundaymail.co.zw/have-faith-in-gods-promise-of-a-brighter-tomorrow
Arts & Culture,Hospital visiting times,"Harare Parirenyatwa Hospital General wards: 1pm-2pm Private wards 5pm-6pm Mbuya Nehanda Hospital: 6am-6:30am, 1pm-2pm — ...",https://www.sundaymail.co.zw/hospital-visiting-times-53
Arts & Culture,NEW: Kanindo singer Shantel Sithole launches fourth album,Online Reporter KANINDO singer Shantel Sithole successfully launched her fourth album “Comment Section” on Wednesday at ...,https://www.sundaymail.co.zw/kanindo-singer-shantel-sithole-launches-fourth-album
Arts & Culture,"Spare a thought for pregnant girls, as schools reopen","Sunday Mail Reporter YOUNG mothers and pregnant girls, especially those from farming communities, should have access to ...",https://www.sundaymail.co.zw/spare-a-thought-for-pregnant-girls-as-schools-reopen
Arts & Culture,Worry over underweight  groceries,"Veronica Gwaze ALICE MUSHUNJE, an avid shopper and bargain hunter, is a troubled soul. After her last two shopping ...",https://www.sundaymail.co.zw/worry-over-underweight-groceries
Arts & Culture,"Woman kills lover, vanishes with lobola money","A Mutare woman residing in Cape Town, South Africa, is on the run after allegedly scalding her husband with cooking oil ...",https://www.sundaymail.co.zw/woman-kills-lover-vanishes-with-lobola-money
Arts & Culture,Chapungu struggling without Guthrie,"Society Reporter THE Chapungu Sculpture Park, which has one of the largest Zimbabwean stone sculpture collections in the ...",https://www.sundaymail.co.zw/chapungu-struggling-without-guthrie
Arts & Culture,"Expired, fake products flood market",Society Reporter UNSCRUPULOUS individuals are putting the lives of consumers at risk by selling fake and expired ...,https://www.sundaymail.co.zw/expired-fake-products-flood-market
Arts & Culture,Don’t let dream voyages  turn into nightmares,"Your Money, Your Call Cresencia Marjorie Chiremba A FEW weeks ago, my sister Letwin and her friends were set for an ...",https://www.sundaymail.co.zw/dont-let-dream-voyages-turn-into-nightmares
Arts & Culture,Local filmmakers aim for the stars,"Film Review Tinashe Kusema CHRISTOPHER NOLAN, James Cameron, Quentin Tarantino, Tim Burton and Steven Spielberg are ...",https://www.sundaymail.co.zw/local-filmmakers-aim-for-the-stars
Arts & Culture,Sculptures can breathe life  into your garden,"Andrew Mangwarara VISITING the Eye Institute in Milton Park, Harare, was an eye- opener for me. Those in charge of the ...",https://www.sundaymail.co.zw/sculptures-can-breathe-life-into-your-garden
Arts & Culture,Learn to read beyond textbooks,Gabriel Manyeruke A SIGNIFICANT decline in the culture of reading among learners at school has been noted in recent ...,https://www.sundaymail.co.zw/learn-to-read-beyond-textbooks
Arts & Culture,Grandmother is ungrateful,"Mudzimba Dr Chisamba Dear Amai, I hope you are well. I am a 36-year-old man and I have a wonderful wife. We are blessed ...",https://www.sundaymail.co.zw/grandmother-is-ungrateful
Arts & Culture,A tasty ‘Haifiridzi’ dish,EVERY Zimbabwean has at one point tasted this vintage dish since beef and veggies are a staple relish in most local ...,https://www.sundaymail.co.zw/a-tasty-haifiridzi-dish
Arts & Culture,"Macheso’s unending challenges on dance floor  . . . from Slomo, Kagomera to Majuice",Prince Mushawevato ORCHESTRA Mberikwazvo’s fans are celebrating the return of star dancer Majuice — born Selemani Mpochi ...,https://www.sundaymail.co.zw/machesos-unending-challenges-on-dance-floor-from-slomo-kagomera-to-majuice
Arts & Culture,Nyaka-Chana makes strides in global film,Society Reporter MULTI-TALENTED artiste Caroline Nyaka-Chana continues to make waves and push the boundaries as she ...,https://www.sundaymail.co.zw/nyaka-chana-makes-strides-in-global-film
Arts & Culture,Shared threads unite Zimbabwe in dress craze,Society Reporter “THIS is nice Tariro. I love your dress!” A social media blogger recently made this comment after radio ...,https://www.sundaymail.co.zw/shared-threads-unite-zim-in-dress-craze
Arts & Culture,The priceless value of mankind  in God’s eyes,"“WHEN I consider your heavens, the work of your fingers, the moon and the stars, which you have set in place, what is ...",https://www.sundaymail.co.zw/the-priceless-value-of-mankind-in-gods-eyes
Arts & Culture,Drug rehabilitation centres,"IN case you have a son, daughter, friend or relative who has a problem with drugs, here is a list and contact details of ...",https://www.sundaymail.co.zw/drug-rehab-centres-44
Arts & Culture,Hospital visiting times,"Harare Parirenyatwa Hospital General wards: 1pm-2pm Private wards 5pm-6pm Mbuya Nehanda Hospital: 6am-6:30am, 1pm-2pm — ...",https://www.sundaymail.co.zw/hospital-visiting-times-52
Arts & Culture,NEW: Zimdancehall singer Mbida D arrested for fraud,ZIMDANCEHALL chanter Mbida D —  real name Gift Zimbita —  has been arrested on allegations of fraud. Mbida D reportedly ...,https://www.sundaymail.co.zw/new-zimdancehall-singer-mbida-d-arrested-for-fraud
Arts & Culture,Agga Nyabinde dedicates songs to late father,"Online Reporter AFRO-fusion artist Agga Nyabinde, son of the late musician Bob Nyabinde, has dedicated three songs to ...",https://www.sundaymail.co.zw/agga-nyabinde-dedicates-songs-to-late-father
Arts & Culture,NEW: All set for Jabulani Jazz Music Festival,Online Reporter  HARARE is set to host this year’s edition of the Jabulani Jazz Music Festival on April 27. Artistes to ...,https://www.sundaymail.co.zw/new-all-set-for-jabulani-jazz-music-festival
Arts & Culture,Hi-tech machines promise medical revolution,Society Reporter A GROUNDBREAKING concept — the health automated teller machine (ATM) — is understood to be pushing the ...,https://www.sundaymail.co.zw/hi-tech-machines-promise-medical-revolution
Arts & Culture,HISTORIC POSTCARD FROM BUHERA,"Kuda Bwititi recently in BUHERA FOR the people of Buhera, Manicaland province, memories from last week’s main ...",https://www.sundaymail.co.zw/historic-postcard-from-buhera
Arts & Culture,"Man sodomised, loses  car to thieves",A man from Bulawayo’s Pumula South suburb was left counting his losses after two armed robbers allegedly choked him ...,https://www.sundaymail.co.zw/man-sodomised-loses-car-to-thieves
Arts & Culture,"Harare City Council, please mind your own business","Cresencia Marjorie Chiremba Your Money, Your Call THE City of Harare recently hinted on plans to introduce parking fees ...",https://www.sundaymail.co.zw/harare-city-council-please-mind-your-own-business
Arts & Culture,A soul-soothing gadern project,"Andrew Mangwarara ORTHOSMILE DENTAL CLINIC, which is run by Dr Farai Nhembe, is located in Milton Park, Harare. Its ...",https://www.sundaymail.co.zw/a-soul-soothing-gadern-project
Arts & Culture,A welcoming home for Rwandan elderly who lost family in genocide,"Glory Iribagiza THERESE UZABAKIRIHO, 64, was married with four children and another on the way during the 1994 Genocide ...",https://www.sundaymail.co.zw/a-welcoming-home-for-rwandan-elderly-who-lost-family-in-genocide
Arts & Culture,I lied about my father’s girlfriend,"Mudzimba Dr Chisamba DEAR Amai, how are you? I am a 16-year-old girl and I come from an unhappy home. There are four of ...",https://www.sundaymail.co.zw/i-lied-about-my-fathers-girlfriend-2
Arts & Culture,Drug rehabilitation centres,"IN case you have a son, daughter, friend or relative who has a problem with drugs, here is a list and contact details of ...",https://www.sundaymail.co.zw/drug-rehab-centres-43
Arts & Culture,Enjoy cow heels and bean stew,"COW heels (mazondo), together with beans, make a filling meal that also has hidden health benefits. The meal is rich in ...",https://www.sundaymail.co.zw/enjoy-cow-heels-and-bean-stew
Arts & Culture,Embracing our dominion as God’s children,"“THEN God said, ‘Let us make mankind in our image, in our likeness, so that they may rule over the fish in the sea and ...",https://www.sundaymail.co.zw/embracing-our-dominion-as-gods-children
Arts & Culture,Hospital visiting times,"Harare Parirenyatwa Hospital General wards:1pm-2pm Private wards 5pm-6pm Mbuya Nehanda Hospital: 6am-6:30am, 1pm-2pm — ...",https://www.sundaymail.co.zw/hospital-visiting-times-51
Arts & Culture,Lights dim on local theatre,"Society Reporter THE Covid-19 pandemic, which discouraged gatherings, might have subsided, but it left scars on the ...",https://www.sundaymail.co.zw/lights-dim-on-local-theatre
Arts & Culture,Don’t be limited by  negative circumstances,Gabriel Manyeruke SCHOOL is a place where young people go to learn and grow. Education lays the foundation for a ...,https://www.sundaymail.co.zw/dont-be-limited-by-negative-circumstances
Arts & Culture,Online platforms turn into gold mine for local artistes,"Society Reporters THE social media craze might have its fair share of controversies and baggage, but local artistes seem ...",https://www.sundaymail.co.zw/online-platforms-turn-into-gold-mine-for-local-artistes
Arts & Culture,‘Tsotso’ hitmaker tackles trauma of child abuse,"Society Reporter ‘‘TSOTSO’’ hitmaker Ray Bopoto has dropped his ninth studio album, “Chioma (Good God)”, which tackles ...",https://www.sundaymail.co.zw/tsotso-hitmaker-tackles-trauma-of-child-abuse
Arts & Culture,NEW: 4×4 Jamboree returns to Nyanga,Online Reporter TOURISTS will witness a rare spectacle as the 4×4 Jamboree returns to Nyanga after a 30-year ...,https://www.sundaymail.co.zw/new-4x4-jamboree-returns-to-nyanga
Arts & Culture,NEW: Sungura genre stands the test of time,Theseus Shambare SUNGURA music is proving to be one of the local genres that has stood the test of time. The turn of ...,https://www.sundaymail.co.zw/new-sungura-genre-stands-the-test-of-time
Arts & Culture,"NEW: DJs, musicians clash in Unplugged Coca-Cola Food Festival","Online Reporter MURUMBA Pitch, a dynamic music duo from South Africa, will headline the Unplugged Coca-Cola Food ...",https://www.sundaymail.co.zw/new-djs-musicians-clash-in-unplugged-coca-cola-food-festival
Arts & Culture,The sweet scent of self-rule,"Veronica Gwaze and Theseus Shambare AT the dawn of Zimbabwe’s independence, a staggering 15,5 million hectares of ...",https://www.sundaymail.co.zw/the-sweet-scent-of-self-rule
Arts & Culture,All set for Uhuru gala,"Tendai Chara FOR sungura musician Mark Ngwazi, performing at the Independence Gala at Murambinda B Primary School in ...",https://www.sundaymail.co.zw/all-set-for-uhuru-gala
Arts & Culture,Key attributes of a successful learner,"Gabriel Manyeruke EDUCATION is often described as the passport to the future, the key to success and the foundation of a ...",https://www.sundaymail.co.zw/key-attributes-of-a-successful-learner
Arts & Culture,Here is what others had to say about Zimbabwe’s independence,Father Paul Mayeresa LIFE as a priest during the colonial era was hectic since our white counterparts received ...,https://www.sundaymail.co.zw/here-is-what-others-had-to-say-about-zimbabwes-independence
Arts & Culture,When star power creates cinematic gold,"Film Review Tinashe Kusema WELL, the reviews are in and it is safe to say that “Dune: Part Two” exceeded all ...",https://www.sundaymail.co.zw/when-star-power-creates-cinematic-gold
Arts & Culture,We want our change back,"Your Money, Your Call Cresencia Marjorie Chiremba ON April 5, 2024, the Reserve Bank of Zimbabwe introduced a new ...",https://www.sundaymail.co.zw/we-want-our-change-back
Arts & Culture,Sculptor lifts Zimbabwe’s flag high,"Society Reporter LIBERTY NYANHONGO, a 34-year-old Zimbabwean sculptor based in Windhoek, Namibia, is lifting the ...",https://www.sundaymail.co.zw/sculptor-lifts-zim-flag-high
Arts & Culture,Beyoncé country album shatters records,"BEYONCÉ has become the first black artiste ever to hit number one with a country album in the United Kingdom, topping ...",https://www.sundaymail.co.zw/beyonce-country-album-shatters-records
Arts & Culture,Client slain by enraged sex worker,A man who allegedly failed to pay for sexual services was stoned and had his palm chopped off with a machete before he ...,https://www.sundaymail.co.zw/client-slain-by-enraged-sex-worker
