category,title,story,url
Arts&Culture,Have faith in God’s promise of a brighter tomorrow,"“INSTEAD of bronze, I will bring you gold; instead of iron, I will bring you silver; instead of wood, I will bring you ...",https://www.sundaymail.co.zw/have-faith-in-gods-promise-of-a-brighter-tomorrow
Arts&Culture,Hospital visiting times,"Harare Parirenyatwa Hospital General wards: 1pm-2pm Private wards 5pm-6pm Mbuya Nehanda Hospital: 6am-6:30am, 1pm-2pm — ...",https://www.sundaymail.co.zw/hospital-visiting-times-53
Arts&Culture,NEW: Kanindo singer Shantel Sithole launches fourth album,Online Reporter KANINDO singer Shantel Sithole successfully launched her fourth album “Comment Section” on Wednesday at ...,https://www.sundaymail.co.zw/kanindo-singer-shantel-sithole-launches-fourth-album
Arts&Culture,"Spare a thought for pregnant girls, as schools reopen","Sunday Mail Reporter YOUNG mothers and pregnant girls, especially those from farming communities, should have access to ...",https://www.sundaymail.co.zw/spare-a-thought-for-pregnant-girls-as-schools-reopen
Arts&Culture,Worry over underweight  groceries,"Veronica Gwaze ALICE MUSHUNJE, an avid shopper and bargain hunter, is a troubled soul. After her last two shopping ...",https://www.sundaymail.co.zw/worry-over-underweight-groceries
Arts&Culture,"Woman kills lover, vanishes with lobola money","A Mutare woman residing in Cape Town, South Africa, is on the run after allegedly scalding her husband with cooking oil ...",https://www.sundaymail.co.zw/woman-kills-lover-vanishes-with-lobola-money
Arts&Culture,Chapungu struggling without Guthrie,"Society Reporter THE Chapungu Sculpture Park, which has one of the largest Zimbabwean stone sculpture collections in the ...",https://www.sundaymail.co.zw/chapungu-struggling-without-guthrie
Arts&Culture,"Expired, fake products flood market",Society Reporter UNSCRUPULOUS individuals are putting the lives of consumers at risk by selling fake and expired ...,https://www.sundaymail.co.zw/expired-fake-products-flood-market
Arts&Culture,Don’t let dream voyages  turn into nightmares,"Your Money, Your Call Cresencia Marjorie Chiremba A FEW weeks ago, my sister Letwin and her friends were set for an ...",https://www.sundaymail.co.zw/dont-let-dream-voyages-turn-into-nightmares
Arts&Culture,Local filmmakers aim for the stars,"Film Review Tinashe Kusema CHRISTOPHER NOLAN, James Cameron, Quentin Tarantino, Tim Burton and Steven Spielberg are ...",https://www.sundaymail.co.zw/local-filmmakers-aim-for-the-stars
Arts&Culture,Sculptures can breathe life  into your garden,"Andrew Mangwarara VISITING the Eye Institute in Milton Park, Harare, was an eye- opener for me. Those in charge of the ...",https://www.sundaymail.co.zw/sculptures-can-breathe-life-into-your-garden
Arts&Culture,Learn to read beyond textbooks,Gabriel Manyeruke A SIGNIFICANT decline in the culture of reading among learners at school has been noted in recent ...,https://www.sundaymail.co.zw/learn-to-read-beyond-textbooks
Arts&Culture,Grandmother is ungrateful,"Mudzimba Dr Chisamba Dear Amai, I hope you are well. I am a 36-year-old man and I have a wonderful wife. We are blessed ...",https://www.sundaymail.co.zw/grandmother-is-ungrateful
Arts&Culture,A tasty ‘Haifiridzi’ dish,EVERY Zimbabwean has at one point tasted this vintage dish since beef and veggies are a staple relish in most local ...,https://www.sundaymail.co.zw/a-tasty-haifiridzi-dish
Arts&Culture,"Macheso’s unending challenges on dance floor  . . . from Slomo, Kagomera to Majuice",Prince Mushawevato ORCHESTRA Mberikwazvo’s fans are celebrating the return of star dancer Majuice — born Selemani Mpochi ...,https://www.sundaymail.co.zw/machesos-unending-challenges-on-dance-floor-from-slomo-kagomera-to-majuice
Arts&Culture,Nyaka-Chana makes strides in global film,Society Reporter MULTI-TALENTED artiste Caroline Nyaka-Chana continues to make waves and push the boundaries as she ...,https://www.sundaymail.co.zw/nyaka-chana-makes-strides-in-global-film
Arts&Culture,Shared threads unite Zimbabwe in dress craze,Society Reporter “THIS is nice Tariro. I love your dress!” A social media blogger recently made this comment after radio ...,https://www.sundaymail.co.zw/shared-threads-unite-zim-in-dress-craze
Arts&Culture,The priceless value of mankind  in God’s eyes,"“WHEN I consider your heavens, the work of your fingers, the moon and the stars, which you have set in place, what is ...",https://www.sundaymail.co.zw/the-priceless-value-of-mankind-in-gods-eyes
Arts&Culture,Drug rehabilitation centres,"IN case you have a son, daughter, friend or relative who has a problem with drugs, here is a list and contact details of ...",https://www.sundaymail.co.zw/drug-rehab-centres-44
Arts&Culture,Hospital visiting times,"Harare Parirenyatwa Hospital General wards: 1pm-2pm Private wards 5pm-6pm Mbuya Nehanda Hospital: 6am-6:30am, 1pm-2pm — ...",https://www.sundaymail.co.zw/hospital-visiting-times-52
Arts&Culture,NEW: Zimdancehall singer Mbida D arrested for fraud,ZIMDANCEHALL chanter Mbida D —  real name Gift Zimbita —  has been arrested on allegations of fraud. Mbida D reportedly ...,https://www.sundaymail.co.zw/new-zimdancehall-singer-mbida-d-arrested-for-fraud
Arts&Culture,Agga Nyabinde dedicates songs to late father,"Online Reporter AFRO-fusion artist Agga Nyabinde, son of the late musician Bob Nyabinde, has dedicated three songs to ...",https://www.sundaymail.co.zw/agga-nyabinde-dedicates-songs-to-late-father
Arts&Culture,NEW: All set for Jabulani Jazz Music Festival,Online Reporter  HARARE is set to host this year’s edition of the Jabulani Jazz Music Festival on April 27. Artistes to ...,https://www.sundaymail.co.zw/new-all-set-for-jabulani-jazz-music-festival
Arts&Culture,Hi-tech machines promise medical revolution,Society Reporter A GROUNDBREAKING concept — the health automated teller machine (ATM) — is understood to be pushing the ...,https://www.sundaymail.co.zw/hi-tech-machines-promise-medical-revolution
Arts&Culture,HISTORIC POSTCARD FROM BUHERA,"Kuda Bwititi recently in BUHERA FOR the people of Buhera, Manicaland province, memories from last week’s main ...",https://www.sundaymail.co.zw/historic-postcard-from-buhera
Arts&Culture,"Man sodomised, loses  car to thieves",A man from Bulawayo’s Pumula South suburb was left counting his losses after two armed robbers allegedly choked him ...,https://www.sundaymail.co.zw/man-sodomised-loses-car-to-thieves
Arts&Culture,"Harare City Council, please mind your own business","Cresencia Marjorie Chiremba Your Money, Your Call THE City of Harare recently hinted on plans to introduce parking fees ...",https://www.sundaymail.co.zw/harare-city-council-please-mind-your-own-business
Sports,NEW: Warriors to play Lesotho at Orlando Stadium in World Cup qualifier,"Online Reporter ZIMBABWE will play their next World Cup qualifier against Lesotho at Orlando Stadium in Johannesburg, ...",https://www.sundaymail.co.zw/new-warriors-to-play-lesotho-at-orlando-stadium-in-world-cup-qualifier
Sports,"Three epic PSL matches to watch today . . . Dynamos, Highlanders, CAPS United in tough battles","Tadious Manyepo Sports Reporter COMPETITION in the Castle Lager Premier Soccer League is heating up, with much expected ...",https://www.sundaymail.co.zw/three-epic-psl-matches-to-watch-today-dynamos-highlanders-caps-united-in-tough-battles
Sports,"PSL act on DeMbare, Chegutu Pirates game",Sports Reporter THE Premier Soccer League (PSL) have begun acting on the aborted game between Chegutu Pirates and ...,https://www.sundaymail.co.zw/psl-act-on-dembare-chegutu-pirates-game
Sports,Peter Ndlovu backs local players,Langton Nyakwenda FORMER Dynamos star Samson Choruwa might have faded into oblivion since a nasty knee-injury cut short ...,https://www.sundaymail.co.zw/peter-ndlovu-backs-local-players
Sports,Splinter netball league emerges amid chaos,Veronica Gwaze Sports Reporter A breakaway netball league called Tacco Super Netball League (TSNL) has been formed ...,https://www.sundaymail.co.zw/splinter-netball-league-emerges-amid-chaos
Sports,Olympic dream takes backseat  for runner Mudzinganyama,Tinashe Kusema Zimpapers Sports Hub WHAT a difference a couple of pictures can make! The Totalsports Two Oceans Marathon ...,https://www.sundaymail.co.zw/olympic-dream-takes-backseat-for-runner-mudzinganyama
Sports,Power behind the gloves  Phiri  impacts boxing,Langton Nyakwenda RARELY do you see them grabbing the headlines because most of the attention goes to those in the ...,https://www.sundaymail.co.zw/power-behind-the-gloves-phiri-impacts-boxing
Sports,It’s high time mines begin mining talent again,THE Paris 2024 Summer Olympic Games are now a little less than 90 days away. These quadrennial sporting festivals are ...,https://www.sundaymail.co.zw/its-high-time-mines-begin-mining-talent-again
Sports,"Antipas conduct taints  Chicken Inn, Yadah match",Zimpapers Sports Hub CHICKEN INN coach Joey Antipas hogged the limelight for the wrong reasons in the Castle Lager ...,https://www.sundaymail.co.zw/antipas-conduct-taints-chicken-inn-yadah-match
Sports,Makarawu shatters record on road to Olympics,Tinashe Kusema NATIONAL Athletics Association of Zimbabwe (NAAZ) president Tendayi Tagara felt vindicated as news broke ...,https://www.sundaymail.co.zw/makarawu-shatters-record-on-road-to-olympics
Sports,"Quest for revenge anchors Zimbabwe, Kenya  rugby final",Zimpapers Sports Hub WHEN Zimbabwe and Kenya meet in the Barthes Trophy final at Harare Sports Club’s Machinery Exchange ...,https://www.sundaymail.co.zw/quest-for-revenge-anchors-zimbabwe-kenya-rugby-final
Sports,"NEW: Dembare, Chegutu Pirates match abandoned",Online Reporter Chegutu Pirates   …..  0 Dynamos…………….. (0) 1 GOAL-LINE TECHNOLOGY ...,https://www.sundaymail.co.zw/dembarenew-dembare-chegutu-pirates-match-abandoned
Sports, NEW: ‘Pogba’ shines again  …as Grabowski speaks highly of 12-year-old starlet,Online Reporter While Continental Bright Stars Academy dominated at an Independence tournament held at Ngoni Stadium in ...,https://www.sundaymail.co.zw/new-pogba-shines-again-as-grabowski-speaks-highly-of-12-year-old-starlet
Sports,Premier  League  action sees  four draws . . . including FC Platinum’s missed opportunity,"Zimpapers Sports Hub DRAWS were the order of the day yesterday in the Castle Lager Premier Soccer League, with all four ...",https://www.sundaymail.co.zw/premier-league-action-sees-four-draws-including-fc-platinums-missed-opportunity
Sports,"Three epic PSL matches to watch today . . . Dynamos, Highlanders, CAPS United in tough battles","Tadious Manyepo Sports Reporter COMPETITION in the Castle Lager Premier Soccer League is heating up, with much expected ...",https://www.sundaymail.co.zw/three-epic-psl-matches-to-watch-today-dynamos-highlanders-caps-united-in-tough-battles
Sports,"PSL act on DeMbare, Chegutu Pirates game",Sports Reporter THE Premier Soccer League (PSL) have begun acting on the aborted game between Chegutu Pirates and ...,https://www.sundaymail.co.zw/psl-act-on-dembare-chegutu-pirates-game
Sports,Peter Ndlovu backs local players,Langton Nyakwenda FORMER Dynamos star Samson Choruwa might have faded into oblivion since a nasty knee-injury cut short ...,https://www.sundaymail.co.zw/peter-ndlovu-backs-local-players
Sports,Splinter netball league emerges amid chaos,Veronica Gwaze Sports Reporter A breakaway netball league called Tacco Super Netball League (TSNL) has been formed ...,https://www.sundaymail.co.zw/splinter-netball-league-emerges-amid-chaos
Sports,Olympic dream takes backseat  for runner Mudzinganyama,Tinashe Kusema Zimpapers Sports Hub WHAT a difference a couple of pictures can make! The Totalsports Two Oceans Marathon ...,https://www.sundaymail.co.zw/olympic-dream-takes-backseat-for-runner-mudzinganyama
Sports,Power behind the gloves  Phiri  impacts boxing,Langton Nyakwenda RARELY do you see them grabbing the headlines because most of the attention goes to those in the ...,https://www.sundaymail.co.zw/power-behind-the-gloves-phiri-impacts-boxing
Sports,It’s high time mines begin mining talent again,THE Paris 2024 Summer Olympic Games are now a little less than 90 days away. These quadrennial sporting festivals are ...,https://www.sundaymail.co.zw/its-high-time-mines-begin-mining-talent-again
Sports,"Antipas conduct taints  Chicken Inn, Yadah match",Zimpapers Sports Hub CHICKEN INN coach Joey Antipas hogged the limelight for the wrong reasons in the Castle Lager ...,https://www.sundaymail.co.zw/antipas-conduct-taints-chicken-inn-yadah-match
Sports,Makarawu shatters record on road to Olympics,Tinashe Kusema NATIONAL Athletics Association of Zimbabwe (NAAZ) president Tendayi Tagara felt vindicated as news broke ...,https://www.sundaymail.co.zw/makarawu-shatters-record-on-road-to-olympics
Sports,"Quest for revenge anchors Zimbabwe, Kenya  rugby final",Zimpapers Sports Hub WHEN Zimbabwe and Kenya meet in the Barthes Trophy final at Harare Sports Club’s Machinery Exchange ...,https://www.sundaymail.co.zw/quest-for-revenge-anchors-zimbabwe-kenya-rugby-final
Sports,"NEW: Dembare, Chegutu Pirates match abandoned",Online Reporter Chegutu Pirates   …..  0 Dynamos…………….. (0) 1 GOAL-LINE TECHNOLOGY ...,https://www.sundaymail.co.zw/dembarenew-dembare-chegutu-pirates-match-abandoned
Sports, NEW: ‘Pogba’ shines again  …as Grabowski speaks highly of 12-year-old starlet,Online Reporter While Continental Bright Stars Academy dominated at an Independence tournament held at Ngoni Stadium in ...,https://www.sundaymail.co.zw/new-pogba-shines-again-as-grabowski-speaks-highly-of-12-year-old-starlet
Sports,Premier  League  action sees  four draws . . . including FC Platinum’s missed opportunity,"Zimpapers Sports Hub DRAWS were the order of the day yesterday in the Castle Lager Premier Soccer League, with all four ...",https://www.sundaymail.co.zw/premier-league-action-sees-four-draws-including-fc-platinums-missed-opportunity
Sports,The road to Bangladesh: Lady Chevrons  ready for qualifiers,"Don Makanyanga Sports Reporter ZIMBABWE’S senior women’s cricket team, the Lady Chevrons, will seek to correct their ...",https://www.sundaymail.co.zw/the-road-to-bangladesh-lady-chevrons-ready-for-qualifiers
Sports,Documentary celebrates  Tymon Mabaleka’s exploits,"Don Makanyanga Sports Reporter EVERY time the name Tymon Mabaleka is mentioned, many will remember the late footballer ...",https://www.sundaymail.co.zw/documentary-celebrates-tymon-mabalekas-exploits
Sports,"Junior Sables secure Barthes first win, eye further success",Tinashe Kusema Zimbabwe Under-20  . . . . . . . . . . . . . . (19) 46 Tunisia Under-20 . . . . . . . . . . . . . . . . ...,https://www.sundaymail.co.zw/junior-sables-secure-barthes-first-win-eye-further-success
Sports,Warriors to play  Lesotho in  South Africa . . . as fans take ZIFA to task over coach appointment,Sports Reporters WHILE the Zimbabwe Football Association (ZIFA) Normalisation Committee remains tight-lipped on the ...,https://www.sundaymail.co.zw/warriors-to-play-lesotho-in-south-africa-as-fans-take-zifa-to-task-over-coach-appointment
Sports,Uhuru Cup  venues find new life as schools  of excellence,"Tadious Manyepo Sports Reporter THE case of stadiums and venues turning into white elephants, especially after countries ...",https://www.sundaymail.co.zw/uhuru-cup-venues-find-new-life-as-schools-of-excellence
Sports,Show sports fans some respect!,"OUR Premier Soccer League is quite unique, as it probably is the only elite division where a 51-year-old feels fit and ...",https://www.sundaymail.co.zw/show-sports-fans-some-respect
Sports,How much cover do our athletes have?,"Arthur Choga IN the years I spent in sports management, I have learnt that there are two main things that can affect a ...",https://www.sundaymail.co.zw/how-much-cover-do-our-athletes-have
Sports,Bosso rescue point from Ngezi,Zimpapers Sports Hub PACESETTERS Highlanders are guaranteed another week at the summit of the log after rescuing a point ...,https://www.sundaymail.co.zw/bosso-rescue-point-from-ngezi
Sports,Uhuru clash excites Buhera,Sports Reporter The Independence Cup clash between Dynamos and Highlanders at the Murambinda B High School grounds in ...,https://www.sundaymail.co.zw/uhuru-clash-excites-buhera
Sports,World Cup preps on,"WITH preparations for hosting the 2027 World Cup in motion, Zimbabwe Cricket (ZC) is set to expand the capacity of the ...",https://www.sundaymail.co.zw/world-cup-preps-on
Sports,Let the games begin,LATE confirmation due to an impasse between the Zimbabwe Rugby Union (ZRU) and the Sports and Recreation Commission ...,https://www.sundaymail.co.zw/let-the-games-begin
Sports,Crowd trouble: Should we bring back bouncers?,"Some soccer fans were more than convinced that the late Premier Soccer League referee, Tichaona “Giant” Chapfika, was a ...",https://www.sundaymail.co.zw/crowd-trouble-should-we-bring-back-bouncers
Sports,My first love was football: Masvanise,"Tinashe Kusema WHEN Wilson Masvanise stepped onto the stage during last weekend’s Novice Zimbabwe competition, the ...",https://www.sundaymail.co.zw/my-first-love-was-football-masvanise
Sports,Zim duo spoil SA’s Two Oceans party,Sports Reporter THE Zimbabwe duo of Givemore Mudzinganyama and Loveness Madziva played the role of party spoilers to ...,https://www.sundaymail.co.zw/zim-duo-spoil-sas-two-oceans-party
Sports,Murambinda makes Independence Cup history,"Langton Nyakwenda ON Thursday, Murambinda in Buhera writes its own piece of history when it hosts the country’s two ...",https://www.sundaymail.co.zw/murambinda-makes-independence-cup-history
